id,session,identifier,title,jurisdiction_id,media_type,url,note
37a34cdf-265c-4f4c-8c4c-1d487f84c86b,2019,HB 1290,TO AMEND THE PROVISIONS OF THE ARKANSAS CODE CONCERNING THE PRACTICE OF PHARMACY; AND TO AUTHORIZE PHARMACISTS TO PROVIDE ACCESS TO AND ADMINISTRATION OF ORAL CONTRACEPTIVES.,ocd-jurisdiction/country:us/state:ar/government,application/pdf,ftp://www.arkleg.state.ar.us/Bills/2019R/Public/Searchable/HB1290.pdf,HB 1290
6967d3ae-5ed9-41a4-b0c5-2758ccf6a303,2019,HB 1229,TO AMEND THE LAW CONCERNING PROCUREMENT REQUIREMENTS RELATING TO INFORMATION TECHNOLOGY ACCESS FOR THE BLIND.,ocd-jurisdiction/country:us/state:ar/government,application/pdf,ftp://www.arkleg.state.ar.us/Bills/2019R/Public/Searchable/HB1229.pdf,HB 1229
7a86573f-555e-49f3-bf05-94976e29587f,2019,SB 263,TO AMEND THE AMUSEMENT RIDE AND AMUSEMENT ATTRACTION SAFETY INSURANCE ACT; TO AMEND THE FREQUENCY OF INFLATABLE ATTRACTION INSPECTIONS; AND TO REMOVE THE REQUIREMENT FOR AN INSURER TO INSPECT AN INFLATABLE ATTRACTION.,ocd-jurisdiction/country:us/state:ar/government,application/pdf,ftp://www.arkleg.state.ar.us/Bills/2019R/Public/Searchable/SB263.pdf,SB 263
aef7aaa1-6e46-4326-9961-23544d267750,2019,SB 250,TO AMEND THE LAW CONCERNING EDUCATIONAL NEGLECT; AND TO AMEND THE LAW CONCERNING REPORTS OF EDUCATIONAL NEGLECT MADE TO THE CHILD ABUSE HOTLINE.,ocd-jurisdiction/country:us/state:ar/government,application/pdf,ftp://www.arkleg.state.ar.us/Bills/2019R/Public/Searchable/SB250.pdf,SB 250
964e314c-37d2-493b-a5da-af6ac636e997,2019,HB 1086,AN ACT FOR THE ARKANSAS VETERANS' CHILD WELFARE SERVICE OFFICE APPROPRIATION FOR THE 2019-2020 FISCAL YEAR.,ocd-jurisdiction/country:us/state:ar/government,application/pdf,ftp://www.arkleg.state.ar.us/Bills/2019R/Public/Searchable/HB1086.pdf,HB 1086
7bb401d6-6a3d-43a5-aa7b-7eebf7807f67,2019,SB 653,TO CREATE THE STRONG FAMILIES ACT; AND TO CREATE AN INCOME TAX CREDIT FOR EMPLOYERS THAT PROVIDE PAID FAMILY AND MEDICAL LEAVE FOR CERTAIN EMPLOYEES.,ocd-jurisdiction/country:us/state:ar/government,application/pdf,ftp://www.arkleg.state.ar.us/Bills/2019R/Public/Searchable/SB653.pdf,SB 653
c914ede3-fa40-4621-a370-5250f16dc3c4,2018F,HB 1010,AN ACT FOR THE VETERINARY MEDICAL EXAMINING BOARD APPROPRIATION FOR THE 2018-2019 FISCAL YEAR.,ocd-jurisdiction/country:us/state:ar/government,application/pdf,ftp://www.arkleg.state.ar.us/Bills/2018F/Public/Searchable/HB1010.pdf,HB 1010
399f0146-7a71-4b48-a55a-f2c5a9748013,2018F,HR 1010,TO AUTHORIZE THE INTRODUCTION OF A NONAPPROPRIATION BILL CONCERNING THE ASSESSMENT FEE ON HOSPITALS.,ocd-jurisdiction/country:us/state:ar/government,application/pdf,ftp://www.arkleg.state.ar.us/Bills/2018F/Public/Searchable/HR1010.pdf,HR 1010
b48657ef-7154-48ef-9ad1-2d3a4e3ef85e,2019,HB 1022,CONCERNING THE CIVIL AND CRIMINAL LIABILITY OF MANDATED REPORTERS WHO ACT IN GOOD FAITH.,ocd-jurisdiction/country:us/state:ar/government,application/pdf,ftp://www.arkleg.state.ar.us/Bills/2019R/Public/Searchable/HB1022.pdf,HB 1022
8d2666ff-3cef-4fbc-a2a6-6e99cb5704f3,2019,HB 1739,TO AMEND THE LAW CONCERNING THE PROCESS OF PROVIDING REDEMPTION DEEDS BY THE COMMISSIONER OF STATE LANDS; AND TO EXPAND THE FORMS OF ACCEPTABLE PAYMENT.,ocd-jurisdiction/country:us/state:ar/government,application/pdf,ftp://www.arkleg.state.ar.us/Bills/2019R/Public/Searchable/HB1739.pdf,HB 1739
9fb6f528-4e14-48f8-9e73-28df9c41c73d,2019,HB 1108,TO CREATE AN EXEMPTION FROM THE INCOME TAX FOR SERVICE PAY AND ALLOWANCES OF FOREIGN SERVICE PERSONNEL; AND TO REPEAL OBSOLETE PROVISIONS OF THE INCOME TAX LAWS.,ocd-jurisdiction/country:us/state:ar/government,application/pdf,ftp://www.arkleg.state.ar.us/Bills/2019R/Public/Searchable/HB1108.pdf,HB 1108
ab29c81f-e8d6-4b48-9218-ea28b8cc4dca,2018F,SB 11,AN ACT FOR THE ARKANSAS FIRE PROTECTION LICENSING BOARD APPROPRIATION FOR THE 2018-2019 FISCAL YEAR.,ocd-jurisdiction/country:us/state:ar/government,application/pdf,ftp://www.arkleg.state.ar.us/Bills/2018F/Public/Searchable/SB11.pdf,SB 11
1d9a967d-1197-43aa-84aa-c88cc6f878c8,2019,SB 645,CONCERNING SUBURBAN IMPROVEMENT DISTRICTS AND REAL PROPERTY.,ocd-jurisdiction/country:us/state:ar/government,application/pdf,ftp://www.arkleg.state.ar.us/Bills/2019R/Public/Searchable/SB645.pdf,SB 645
5f1c59e4-d318-49b9-be9e-7b862e192d48,2019,SB 349,TO REQUIRE THE DEPARTMENT OF EDUCATION TO PROVIDE CERTAIN LEVELS OF SUPPORT TO CERTAIN PUBLIC SCHOOL DISTRICTS BASED ON READING SCORES; AND TO AMEND THE PURPOSES ON WHICH NATIONAL SCHOOL LUNCH STATE CATEGORICAL FUNDS MAY BE SPENT.,ocd-jurisdiction/country:us/state:ar/government,application/pdf,ftp://www.arkleg.state.ar.us/Bills/2019R/Public/Searchable/SB349.pdf,SB 349
117f3c2f-1292-45a0-bec3-072aec742f24,2019,HB 1376,TO AMEND THE LAW CONCERNING THE SALE OF COUNTY PROPERTY.,ocd-jurisdiction/country:us/state:ar/government,application/pdf,ftp://www.arkleg.state.ar.us/Bills/2019R/Public/Searchable/HB1376.pdf,HB 1376
79e484fa-b38d-49ad-ac8e-13fb318fadc0,2018F,HR 1004,"TO AUTHORIZE THE INTRODUCTION OF A NONAPPROPRIATION BILL TO AMEND THE REVENUE STABILIZATION LAW AND TO CREATE FUNDS, TO REPEAL FUNDS, AND TO MAKE TRANSFERS TO AND FROM FUNDS AND FUND ACCOUNTS.",ocd-jurisdiction/country:us/state:ar/government,application/pdf,ftp://www.arkleg.state.ar.us/Bills/2018F/Public/Searchable/HR1004.pdf,HR 1004
84fee4e1-5d23-4157-87ec-7784dd517a03,2019,SB 214,TO AMEND THE LAW REGARDING THE ARKANSAS TEACHER RETIREMENT SYSTEM.,ocd-jurisdiction/country:us/state:ar/government,application/pdf,ftp://www.arkleg.state.ar.us/Bills/2019R/Public/Searchable/SB214.pdf,SB 214
b5941c1e-fb3e-40d3-8f5c-9d64683ec94b,2019,HB 1106,AN ACT FOR THE DEPARTMENT OF FINANCE AND ADMINISTRATION - REVENUE SERVICES DIVISION APPROPRIATION FOR THE 2019-2020 FISCAL YEAR.,ocd-jurisdiction/country:us/state:ar/government,application/pdf,http://www.arkleg.state.ar.us/assembly/2019/2019R/Amendments/HB1106-H1.pdf,Amendment H1
38bcd78a-28f0-4ce5-892e-a2ca7511d8db,2018F,SB 27,AN ACT FOR THE ARKANSAS FAIR HOUSING COMMISSION APPROPRIATION FOR THE 2018-2019 FISCAL YEAR.,ocd-jurisdiction/country:us/state:ar/government,application/pdf,ftp://www.arkleg.state.ar.us/Bills/2018F/Public/Searchable/SB27.pdf,SB 27
51c1e4dc-8cfd-46d5-8aae-262b3133d576,2019,HB 1880,"CONCERNING THE DISTRICT COURTS OF INDEPENDENCE, FULTON, AND IZARD COUNTIES.",ocd-jurisdiction/country:us/state:ar/government,application/pdf,http://www.arkleg.state.ar.us/assembly/2019/2019R/Amendments/HB1880-H1.pdf,Amendment H1
f80d4421-677a-493f-bd7e-33549d59f86b,2019,HB 1283,"TO AMEND THE DEFINITION OF ""PRACTICE OF CERTIFIED REGISTERED NURSE ANESTHESIA""; TO CLARIFY THE SCOPE OF PRACTICE OF A CERTIFIED REGISTERED NURSE ANESTHETIST; AND TO REMOVE SUPERVISION REQUIREMENTS.",ocd-jurisdiction/country:us/state:ar/government,application/pdf,ftp://www.arkleg.state.ar.us/Bills/2019R/Public/Searchable/HB1283.pdf,HB 1283
2b85f6e3-d4e1-4731-aed1-89d1016eecd8,2019,SB 489,AN ACT FOR THE ARKANSAS COMMISSION ON LAW ENFORCEMENT STANDARDS AND TRAINING - LAW ENFORCEMENT TRAINING PROGRAM APPROPRIATION FOR THE 2019-2020 FISCAL YEAR.,ocd-jurisdiction/country:us/state:ar/government,application/pdf,ftp://www.arkleg.state.ar.us/Bills/2019R/Public/Searchable/SB489.pdf,SB 489
9c868f1b-9139-4537-a481-06ca7e36fc1d,2019,HR 1003,TO CONGRATULATE THE BRYANT HORNETS FOOTBALL TEAM ON WINNING THE 2018 CLASS 7A STATE CHAMPIONSHIP.,ocd-jurisdiction/country:us/state:ar/government,application/pdf,ftp://www.arkleg.state.ar.us/Bills/2019R/Public/Searchable/HR1003.pdf,HR 1003
3edd9690-1bcf-4d98-9218-1f7134320477,2019,HB 1488,TO AMEND THE LAW CONCERNING THE ADOPTION PROCESS WHEN A LICENSED CHILD PLACEMENT AGENCY IS NOT USED; AND TO DECLARE AN EMERGENCY.,ocd-jurisdiction/country:us/state:ar/government,application/pdf,ftp://www.arkleg.state.ar.us/Bills/2019R/Public/Searchable/HB1488.pdf,HB 1488
abdb11d3-d66f-4376-a31d-5df46b4075f9,2019,SB 463,"TO AMEND THE LAW CONCERNING INITIATIVES AND REFERENDA; AND TO PROVIDE FOR THE LICENSING, REGISTRATION, AND ENFORCEMENT OF LAWS CONCERNING CERTAIN PERSONS AND ENTITIES THAT PARTICIPATE IN THE PAID CANVASSING INDUSTRY.",ocd-jurisdiction/country:us/state:ar/government,application/pdf,http://www.arkleg.state.ar.us/assembly/2019/2019R/Amendments/SB463-S1.pdf,Amendment S1
30e505b5-0cff-4780-b020-2254e483e922,2019,SB 668,CONCERNING A PUBLIC SCHOOL DISTRICT THAT IS CLASSIFIED AS BEING IN NEED OF LEVEL 5 - INTENSIVE SUPPORT; AND TO ALLOW THE STATE BOARD OF EDUCATION TO GRANT EXTENSIONS OF ITS ASSUMPTION OF AUTHORITY IN CERTAIN SITUATIONS.,ocd-jurisdiction/country:us/state:ar/government,application/pdf,ftp://www.arkleg.state.ar.us/Bills/2019R/Public/Searchable/SB668.pdf,SB 668
dc602627-9274-4eab-a4e7-dab9f9feea19,2019,SB 258,TO INCREASE THE PENALTY FOR TAKING CAMPAIGN FUNDS AS PERSONAL INCOME; AND TO AMEND PROVISIONS OF ARKANSAS LAW RESULTING FROM INITIATED ACT 1 OF 1990 AND INITIATED ACT 1 OF 1996.,ocd-jurisdiction/country:us/state:ar/government,application/pdf,http://www.arkleg.state.ar.us/assembly/2019/2019R/Amendments/SB258-S2.pdf,Amendment S2
e1915708-ca6c-4cd1-b24b-9734adf08632,2019,SB 86,CONCERNING THE DUTIES OF THE COMMISSION FOR PARENT COUNSEL.,ocd-jurisdiction/country:us/state:ar/government,application/pdf,http://www.arkleg.state.ar.us/assembly/2019/2019R/Amendments/SB86-H1.pdf,Amendment H1
bbf1410e-ebbb-43f5-9d66-7f7c4b8df0e9,2019,SR 42,TO ENCOURAGE AND URGE GOVERNOR ASA HUTCHINSON TO ACT EXPEDITIOUSLY ON CERTAIN PAROLE BOARD RECOMMENDATIONS.,ocd-jurisdiction/country:us/state:ar/government,application/pdf,http://www.arkleg.state.ar.us/assembly/2019/2019R/Amendments/SR42-S1.pdf,Amendment S1
fe4b2b52-89e9-4bbe-b971-51ac4af7d601,2019,SCR 5,TO CELEBRATE AND RECOGNIZE WORLD DOWN SYNDROME DAY IN THE STATE OF ARKANSAS.,ocd-jurisdiction/country:us/state:ar/government,application/pdf,ftp://www.arkleg.state.ar.us/Bills/2019R/Public/Searchable/SCR5.pdf,SCR 5
1e90e390-c8e8-437f-b78b-2d2f08cdd6d5,2018F,HB 1105,AN ACT FOR THE PHILLIPS COMMUNITY COLLEGE OF THE UNIVERSITY OF ARKANSAS APPROPRIATION FOR THE 2018-2019 FISCAL YEAR.,ocd-jurisdiction/country:us/state:ar/government,application/pdf,ftp://www.arkleg.state.ar.us/Bills/2018F/Public/Searchable/HB1105.pdf,HB 1105
82924a01-ee81-48c6-ac50-fd608d696e28,2019,SB 606,TO ESTABLISH STANDARD FILING FEES FOR CANDIDATES IN THE ARKANSAS GENERAL ASSEMBLY.,ocd-jurisdiction/country:us/state:ar/government,application/pdf,ftp://www.arkleg.state.ar.us/Bills/2019R/Public/Searchable/SB606.pdf,SB 606
5e3fb6ce-3462-4c10-b7ff-8c8667eb97a6,2019,SB 681,TO CLARIFY THE FREEDOM OF INFORMATION ACT OF 1967 AS IT RELATES TO PUBLIC SCHOOLS; AND TO REQUIRE PUBLIC SCHOOLS TO COMPLY WITH THE FREEDOM OF INFORMATION ACT OF 1967.,ocd-jurisdiction/country:us/state:ar/government,application/pdf,ftp://www.arkleg.state.ar.us/Bills/2019R/Public/Searchable/SB681.pdf,SB 681
8a2e54b1-7ecb-4d35-a281-d24697223e4b,2019,SB 245,"CONCERNING THE DEFINITION OF ""FINAL AVERAGE COMPENSATION"" UNDER THE ARKANSAS PUBLIC EMPLOYEES' RETIREMENT SYSTEM.",ocd-jurisdiction/country:us/state:ar/government,application/pdf,ftp://www.arkleg.state.ar.us/Bills/2019R/Public/Searchable/SB245.pdf,SB 245
d437a02f-e317-4642-a137-0ae90443caf7,2019,SB 261,TO PROVIDE A SALES AND USE TAX EXEMPTION FOR TIMBER MACHINERY AND EQUIPMENT.,ocd-jurisdiction/country:us/state:ar/government,application/pdf,ftp://www.arkleg.state.ar.us/Bills/2019R/Public/Searchable/SB261.pdf,SB 261
e4b2904c-3274-48c6-8b30-f83693f91d04,2019,HB 1135,AN ACT FOR THE OFFICE OF THE TREASURER OF STATE - REFUND OF LOCAL TAXES APPROPRIATION FOR THE 2019-2020 FISCAL YEAR.,ocd-jurisdiction/country:us/state:ar/government,application/pdf,ftp://www.arkleg.state.ar.us/Bills/2019R/Public/Searchable/HB1135.pdf,HB 1135
6d6d3a1a-2eb5-4733-a61d-d75dfebed46f,2019,SB 31,AN ACT FOR THE ARKANSAS STATE BOARD OF DENTAL EXAMINERS APPROPRIATION FOR THE 2019-2020 FISCAL YEAR.,ocd-jurisdiction/country:us/state:ar/government,application/pdf,ftp://www.arkleg.state.ar.us/Bills/2019R/Public/Searchable/SB31.pdf,SB 31
e1919813-f547-4b87-8a43-d740c8539a73,2019,SB 621,"TO BE KNOWN AS THE ""ARKANSAS RED FLAG LAW""; AND TO CREATE AN EXTREME RISK PROTECTION ORDER AND WARRANT.",ocd-jurisdiction/country:us/state:ar/government,application/pdf,ftp://www.arkleg.state.ar.us/Bills/2019R/Public/Searchable/SB621.pdf,SB 621
a4676baf-a22e-4148-a685-7e5686a971f0,2019,HB 1120,AN ACT FOR THE OFFICE OF ATTORNEY GENERAL APPROPRIATION FOR THE 2019-2020 FISCAL YEAR.,ocd-jurisdiction/country:us/state:ar/government,application/pdf,http://www.arkleg.state.ar.us/assembly/2019/2019R/Amendments/HB1120-H1.pdf,Amendment H1
7d2c7c37-c15a-4dca-a15b-fa9b3f4adf38,2019,SB 95,AN ACT FOR THE ARKANSAS TEACHER RETIREMENT SYSTEM APPROPRIATION FOR THE 2019-2020 FISCAL YEAR.,ocd-jurisdiction/country:us/state:ar/government,application/pdf,ftp://www.arkleg.state.ar.us/Bills/2019R/Public/Searchable/SB95.pdf,SB 95
463122a9-afde-4aee-94f0-63849369e5a2,2019,HB 1526,TO AMEND THE LAW CONCERNING THE PURCHASE OF SCHOOL BUSES.,ocd-jurisdiction/country:us/state:ar/government,application/pdf,ftp://www.arkleg.state.ar.us/Bills/2019R/Public/Searchable/HB1526.pdf,HB 1526
04474a7e-4629-4203-89c1-bbfa5fb8f5d6,2019,SB 550,TO AMEND THE LAW REGARDING LIQUID LIVESTOCK LITTER UTILIZATION.,ocd-jurisdiction/country:us/state:ar/government,application/pdf,http://www.arkleg.state.ar.us/assembly/2019/2019R/Amendments/SB550-S1.pdf,Amendment S1
7e97db46-4712-4342-a19d-2f2e6f58670a,2019,HCR 1005,TO COMMEND THE BENTONVILLE HIGH SCHOOL WIND ENSEMBLE.,ocd-jurisdiction/country:us/state:ar/government,application/pdf,ftp://www.arkleg.state.ar.us/Bills/2019R/Public/Searchable/HCR1005.pdf,HCR 1005
ca3ee509-fe48-4e37-a618-3f231acf1d8a,2019,SB 280,TO AMEND THE LAW CONCERNING COMPENSATION AWARDED IN A CONDEMNATION ACTION.,ocd-jurisdiction/country:us/state:ar/government,application/pdf,http://www.arkleg.state.ar.us/assembly/2019/2019R/Amendments/SB280-S1.pdf,Amendment S1
1328c0e3-b74c-4074-8ff9-f83305608682,2018F,HB 1057,AN ACT FOR THE ARKANSAS NATURAL RESOURCES COMMISSION APPROPRIATION FOR THE 2018-2019 FISCAL YEAR.,ocd-jurisdiction/country:us/state:ar/government,application/pdf,ftp://www.arkleg.state.ar.us/Bills/2018F/Public/Searchable/HB1057.pdf,HB 1057
79b89ac7-3eba-4657-bd80-b2f3e5730f97,2019,HB 1973,TO AMEND THE ARKANSAS MOTOR VEHICLE COMMISSION ACT TO COMPLY WITH FEDERAL LAWS AND REGULATIONS.,ocd-jurisdiction/country:us/state:ar/government,application/pdf,ftp://www.arkleg.state.ar.us/Bills/2019R/Public/Searchable/HB1973.pdf,HB 1973
491bfa39-00cb-4d9c-b70b-9d590a0acf7d,2019,HB 1655,TO PROTECT VICTIMS OF DOMESTIC ABUSE.,ocd-jurisdiction/country:us/state:ar/government,application/pdf,http://www.arkleg.state.ar.us/assembly/2019/2019R/Amendments/HB1655-H1.pdf,Amendment H1
f6378198-5866-4242-8ff0-b55d6a28fde1,2019,HB 1205,TO AMEND THE LAW CONCERNING THE AUTHORITY OF THE BOARD OF TRUSTEES TO AWARD AN ANNUAL COST OF LIVING ADJUSTMENT UNDER THE ARKANSAS PUBLIC EMPLOYEES' RETIREMENT SYSTEM.,ocd-jurisdiction/country:us/state:ar/government,application/pdf,ftp://www.arkleg.state.ar.us/Bills/2019R/Public/Searchable/HB1205.pdf,HB 1205
31d9d7ef-dd1e-4535-a955-b1bf94f6ce43,2019,SB 565,CONCERNING THE PUBLIC POLICY OF THE STATE OF ARKANSAS UNDER THE INSURANCE LAWS OF THIS STATE.,ocd-jurisdiction/country:us/state:ar/government,application/pdf,ftp://www.arkleg.state.ar.us/Bills/2019R/Public/Searchable/SB565.pdf,SB 565
d5551d83-fecd-429e-9706-ec67002755e7,2019,SB 629,TO ALLOW FOR THE TRANSFER OF INCOME TAX CREDITS UNDER THE WATER RESOURCE CONSERVATION AND DEVELOPMENT INCENTIVES ACT.,ocd-jurisdiction/country:us/state:ar/government,application/pdf,ftp://www.arkleg.state.ar.us/Bills/2019R/Public/Searchable/SB629.pdf,SB 629
