id,session,identifier,title,jurisdiction_id,media_type,url,note
c72a9074-ae78-4fec-9d28-d02fa72a36f6,2018,HB 1966,Modifies provisions relating to records pertaining to foster homes,ocd-jurisdiction/country:us/state:mo/government,application/pdf,http://www.house.mo.gov/billtracking/bills181/hlrbillspdf/5788H.01I.pdf,Introduced
fbb32c3a-8ecb-4529-aa93-3cad3ee84cce,2018,HB 2450,Adjusts motor vehicle licensing and registration fees for inflation,ocd-jurisdiction/country:us/state:mo/government,application/pdf,http://www.house.mo.gov/billtracking/bills181/hlrbillspdf/6247H.01I.pdf,Introduced
24fb2c72-98ee-400b-a8a1-4a4f9f662649,2018,HB 1753,"Prohibits the collection of water, soil, or commodity samples by governmental entities without the written consent of the landowner",ocd-jurisdiction/country:us/state:mo/government,application/pdf,http://www.house.mo.gov/billtracking/bills181/hlrbillspdf/4920H.01I.pdf,Introduced
45cbb7bc-59e0-4ce7-9735-403008460715,2018,HB 1268,"Allows the Missouri Dental Board to issue dental faculty permits to individuals who are employed by accredited dental schools, colleges, or programs in Missouri",ocd-jurisdiction/country:us/state:mo/government,application/pdf,http://www.house.mo.gov/billtracking/bills181/hlrbillspdf/4125H.01I.pdf,Introduced
6652a067-6de6-494e-b27c-0acfabaf9e2a,2019,SB 378,"Specifies that beginning December 1, 2019, private entities shall be eligible for certification as third-party testers for commercial driver's licenses",ocd-jurisdiction/country:us/state:mo/government,application/pdf,https://www.senate.mo.gov/19info/pdf-bill/intro/SB378.pdf,Introduced
6861b8ba-34f6-4255-a671-7f640fab5a18,2019,SB 386,Modifies provisions relating to the location of a proposed child care facility,ocd-jurisdiction/country:us/state:mo/government,application/pdf,https://www.senate.mo.gov/19info/pdf-bill/intro/SB386.pdf,Introduced
06a35922-19e3-4710-aa11-49be48020f4b,2018,HB 2582,Modifies provisions relating to campaign finance,ocd-jurisdiction/country:us/state:mo/government,application/pdf,http://www.house.mo.gov/billtracking/bills181/hlrbillspdf/6551H.01I.pdf,Introduced
422c9dbf-c786-4b77-b415-5a19f7beeb50,2018,HB 2540,Changes the laws regarding state revenues,ocd-jurisdiction/country:us/state:mo/government,application/pdf,http://www.house.mo.gov/billtracking/bills181/amendpdf/6148H03.70H.pdf,Amendment 6148H03.70H (Distributed)
63a8ced5-a6db-433f-9950-c22524c7202b,2018,HB 1922,Requires the judges of the twenty-second judicial circuit to appoint the sheriff of the City of St. Louis,ocd-jurisdiction/country:us/state:mo/government,application/pdf,http://www.house.mo.gov/billtracking/bills181/hlrbillspdf/5655H.01I.pdf,Introduced
d1c5807f-e493-4b41-abc4-4e5862089e35,2018,HB 2209,Establishes a Prescription Abuse Registry,ocd-jurisdiction/country:us/state:mo/government,application/pdf,http://www.house.mo.gov/billtracking/bills181/hlrbillspdf/6045H.02C.pdf,Committee
6772d492-4b75-46eb-a92e-8be7f2fbc9e8,2018,HB 2649,Changes the cap on tuition charged at public institutions of higher education,ocd-jurisdiction/country:us/state:mo/government,application/pdf,http://www.house.mo.gov/billtracking/bills181/hlrbillspdf/6341H.01I.pdf,Introduced
bdceaa60-6dc2-4ae5-9f78-c5a710682eb7,2018,SJR 34,Allows for a property tax exemption for one hundred percent disabled veterans,ocd-jurisdiction/country:us/state:mo/government,application/pdf,http://www.senate.mo.gov/18info/pdf-bill/intro/SJR34.pdf,Introduced
f04289df-2972-4e4c-a4c6-b1670a038ea3,2018,HB 1938,Creates civil rights for homeless persons.,ocd-jurisdiction/country:us/state:mo/government,application/pdf,http://www.house.mo.gov/billtracking/bills181/hlrbillspdf/5697H.01I.pdf,Introduced
2e98ad50-ef4c-44c6-af73-ccfdff970fb4,2018,HB 1577,Changes the laws relating to labor organizations,ocd-jurisdiction/country:us/state:mo/government,application/pdf,http://www.house.mo.gov/billtracking/bills181/amendpdf/5220H02.11H.pdf,Amendment 5220H02.11H (Distributed)
1675d7b0-02a1-4c23-8b26-7f40e03fec49,2018S2,HB 3,Establishes a statewide STEM career awareness program and creates new provisions of law related to computer science,ocd-jurisdiction/country:us/state:mo/government,application/pdf,http://www.house.mo.gov/billtracking/bills184/amendpdf/6879H01.08H.pdf,Amendment 6879H01.08H (Defeated)
924d1e0f-5239-4fd5-aa54-f771a7f38db4,2017S1,SB 2,Authorizes the Public Service Commission to approve a special rate for aluminum smelting and steel works facilities under certain conditions,ocd-jurisdiction/country:us/state:mo/government,application/pdf,http://www.senate.mo.gov/17info/pdf-bill/S1/intro/SB2.pdf,Introduced
422630c7-6f63-4349-b3fc-d86b7baab61b,2019,SB 251,"Creates the ""Fresh Start Act of 2019""",ocd-jurisdiction/country:us/state:mo/government,application/pdf,https://www.senate.mo.gov/19info/pdf-bill/intro/SB251.pdf,Introduced
4600411a-f39d-4b3c-8f88-fc4110025d65,2018,SB 1088,Modifies the Uniform Agents Athlete Act,ocd-jurisdiction/country:us/state:mo/government,application/pdf,http://www.senate.mo.gov/18info/pdf-bill/intro/SB1088.pdf,Introduced
ca74cb2c-05db-440b-882b-5ed913c2809d,2019,SB 90,Modifies various  provisions relating to employment security,ocd-jurisdiction/country:us/state:mo/government,application/pdf,https://www.senate.mo.gov/19info/pdf-bill/comm/SB90.pdf,Senate Committee Substitute
51978fc6-425a-4bd2-8be6-6abd3c8620a2,2018,HCR 79,Establishes the month of May as Foster Care Awareness month,ocd-jurisdiction/country:us/state:mo/government,application/pdf,http://www.house.mo.gov/billtracking/bills181/hlrbillspdf/6154H.01I.pdf,Introduced
9aacd277-21f6-4450-9fb1-489fec12038e,2018,SB 562,Requires the Department of Social Services to apply for a global waiver for MO HealthNet,ocd-jurisdiction/country:us/state:mo/government,application/pdf,http://www.senate.mo.gov/18info/pdf-bill/intro/SB562.pdf,Introduced
b77457f1-d4f2-4617-9337-c089ac29b11e,2018,HB 1502,Changes provisions relating to advanced practice registered nurses,ocd-jurisdiction/country:us/state:mo/government,application/pdf,http://www.house.mo.gov/billtracking/bills181/hlrbillspdf/4081H.01I.pdf,Introduced
6d029803-e65d-4403-9d66-2ca9213ed702,2018,HB 2361,Modifies provisions relating to the Volunteer Health Services Act,ocd-jurisdiction/country:us/state:mo/government,application/pdf,http://www.house.mo.gov/billtracking/bills181/hlrbillspdf/4432H.01I.pdf,Introduced
f62cce33-b009-4b07-bf3d-ba88991fbcb5,2018,HB 1797,Establishes the Nuclear Power Plant Security Guard Act,ocd-jurisdiction/country:us/state:mo/government,application/pdf,http://www.house.mo.gov/billtracking/bills181/hlrbillspdf/5155H.01P.pdf,Perfected
e0eb5340-62e3-42d7-9363-673fb8eaceb0,2018,HB 1817,Prohibits members and employees of public governmental bodies from using software designed to send encrypted messages that automatically self-destruct to conduct public business,ocd-jurisdiction/country:us/state:mo/government,application/pdf,http://www.house.mo.gov/billtracking/bills181/hlrbillspdf/5385H.01I.pdf,Introduced
3d9b3f10-142b-4fcd-9c97-7b38e60f77e9,2018,HB 2664,"Establishes the ""Extreme Risk Protection Order Act""",ocd-jurisdiction/country:us/state:mo/government,application/pdf,http://www.house.mo.gov/billtracking/bills181/hlrbillspdf/6712H.01I.pdf,Introduced
e41a45a4-0385-4638-a590-ac74bd2612f4,2019,SB 395,Modifies provisions relating to a child's right to counsel,ocd-jurisdiction/country:us/state:mo/government,application/pdf,https://www.senate.mo.gov/19info/pdf-bill/intro/SB395.pdf,Introduced
1c91d323-df03-467b-b65e-e4bf556ff3f0,2018,HB 2003,"Appropriates money for the expenses, grants, refunds, and distributions of the Department of Higher Education",ocd-jurisdiction/country:us/state:mo/government,application/pdf,http://www.house.mo.gov/billtracking/bills181/amendpdf/2003H03.22H.pdf,Amendment 2003H03.22H (Distributed)
99abc2dc-a482-477d-a8fe-adf09cb51d4e,2018,HB 1806,Changes the law regarding property assessments of certain airports,ocd-jurisdiction/country:us/state:mo/government,application/pdf,http://www.house.mo.gov/billtracking/bills181/hlrbillspdf/5374H.01I.pdf,Introduced
8e563c47-ca0a-486f-8635-b59d884b2b97,2018,SB 588,Imposes a gift ban for the members of the General Assembly and their candidate committees,ocd-jurisdiction/country:us/state:mo/government,application/pdf,http://www.senate.mo.gov/18info/pdf-bill/intro/SB588.pdf,Introduced
d30d5710-ba1f-4883-a156-f9723ee42268,2018,SB 1005,Specifies circumstances under which traffic court judges in St. Louis County may review driver's license revocations for refusal to submit to a chemical test,ocd-jurisdiction/country:us/state:mo/government,application/pdf,http://www.senate.mo.gov/18info/pdf-bill/intro/SB1005.pdf,Introduced
532756ec-9b5f-4967-82a1-82d90dcbe925,2018,HCR 93,Urges the Board of Public Buildings to remove the metal detectors and security at the entrance of the capitol building,ocd-jurisdiction/country:us/state:mo/government,application/pdf,http://www.house.mo.gov/billtracking/bills181/hlrbillspdf/6124H.02I.pdf,Introduced
a41057ea-458b-4a93-bf42-93fcb7f9e32f,2018,HB 2221,Modifies provisions relating to registered interior designers,ocd-jurisdiction/country:us/state:mo/government,application/pdf,http://www.house.mo.gov/billtracking/bills181/hlrbillspdf/6051H.01P.pdf,Perfected
029fddfd-2865-42b8-8d71-e3e7564f44a2,2019,SB 357,Allows pharmacists to prescribe drugs and controlled substances according to a written medication therapy services protocol from a physician,ocd-jurisdiction/country:us/state:mo/government,application/pdf,https://www.senate.mo.gov/19info/pdf-bill/intro/SB357.pdf,Introduced
ebfb3abe-1f7b-40a1-a216-16ea5016952d,2018,HB 2038,Modifies provisions relating to salaries for certain county officials,ocd-jurisdiction/country:us/state:mo/government,application/pdf,http://www.house.mo.gov/billtracking/bills181/hlrbillspdf/5467H.02I.pdf,Introduced
c571093a-ae4a-4119-88aa-731bbd739560,2018,HB 2045,Repeals the definition of municipal ordinance violations which were added to the calculation limiting the percentage of annual general operating revenue that can come from fines and court costs for minor violations and allows for confinement for minor traffic violations,ocd-jurisdiction/country:us/state:mo/government,application/pdf,http://www.house.mo.gov/billtracking/bills181/hlrbillspdf/5789H.01I.pdf,Introduced
4cc68a23-065b-4772-a1e8-29a3283abeea,2018,HB 1542,Prohibits certain actions by pharmacy benefits managers,ocd-jurisdiction/country:us/state:mo/government,application/pdf,http://www.house.mo.gov/billtracking/bills181/hlrbillspdf/5330H.02C.pdf,Committee
5597a91a-374c-4c65-b590-e94d06868675,2018,HB 1885,"Allows structured family caregiving as a covered service under MO HealthNet, subject to the approval of federal waivers",ocd-jurisdiction/country:us/state:mo/government,application/pdf,http://www.house.mo.gov/billtracking/bills181/hlrbillspdf/5094H.02C.pdf,Committee
37a5cf97-9d1b-47da-a75d-5771abd3353a,2018,HB 1531,Modifies provisions relating to civil proceedings,ocd-jurisdiction/country:us/state:mo/government,application/pdf,http://www.house.mo.gov/billtracking/bills181/amendpdf/4988H01.05H.pdf,Amendment 4988H01.05H (Distributed)
ec272da4-877b-42b0-8f1d-221a45b7ff82,2018,HB 1697,Designates the third week of September as Historically Black College and University Week,ocd-jurisdiction/country:us/state:mo/government,application/pdf,http://www.house.mo.gov/billtracking/bills181/hlrbillspdf/5314H.01I.pdf,Introduced
89abd139-7de4-4241-8c70-dbc6c0e1c104,2018,HB 1446,Modifies provisions relating to non-election successions in certain political subdivisions,ocd-jurisdiction/country:us/state:mo/government,application/pdf,http://www.house.mo.gov/billtracking/bills181/hlrbillspdf/4467H.03I.pdf,Introduced
163093c0-4a0d-46c0-a85c-1db1edb69ba9,2018,HB 1762,Expands child neglect to include a child that is born with a controlled substance in the child's fluids because the pregnant mother knowingly used a controlled substance before birth,ocd-jurisdiction/country:us/state:mo/government,application/pdf,http://www.house.mo.gov/billtracking/bills181/hlrbillspdf/4949H.01I.pdf,Introduced
a9d8e908-8901-4133-bf74-8b6f976d532d,2018,HB 2381,Designates May as Mental Health Awareness month.,ocd-jurisdiction/country:us/state:mo/government,application/pdf,http://www.house.mo.gov/billtracking/bills181/amendpdf/6288H03.06H.pdf,Amendment 6288H03.06H (Distributed)
1d51e7c5-af33-4ab4-a550-bb0f31eee9fc,2018,HJR 72,Proposes a constitutional amendment to require that the conservation sales tax be renewed by voters every six years,ocd-jurisdiction/country:us/state:mo/government,application/pdf,http://www.house.mo.gov/billtracking/bills181/hlrbillspdf/5289H.01I.pdf,Introduced
7c5f13d1-e2e9-42bb-b197-cb36d1569631,2018,SB 586,Creates the Joint Committee on Disaster Preparedness and Awareness,ocd-jurisdiction/country:us/state:mo/government,application/pdf,http://www.senate.mo.gov/18info/pdf-bill/intro/SB586.pdf,Introduced
dc592745-d238-4fd2-abee-d4502f58ab63,2018,SB 775,"Extends the sunset on certain healthcare provider reimbursement allowance taxes, modifies the hospital reimbursement allowance tax, and modifies the managed care reimbursement allowance tax",ocd-jurisdiction/country:us/state:mo/government,application/pdf,http://www.senate.mo.gov/18info/pdf-bill/perf/SB775.pdf,Perfected
e5d0b622-b454-460d-80fa-7bca02bc3486,2018,HB 2155,Allows wholesalers to employ persons 18 years of age to unload delivery vehicles and transfer liquor into retail premises with supervision,ocd-jurisdiction/country:us/state:mo/government,application/pdf,http://www.house.mo.gov/billtracking/bills181/hlrbillspdf/5892H.02I.pdf,Introduced
53001138-6c63-48b7-a054-23f3f3457fcb,2018,HB 1858,Requires the Department of Revenue to feature a map of all special taxing districts on its website,ocd-jurisdiction/country:us/state:mo/government,application/pdf,http://www.house.mo.gov/billtracking/bills181/amendpdf/5230H01.01H.pdf,Amendment 5230H01.01H (Adopted)
